<?xml version='1.0' encoding='UTF-8'?>
<?xml-stylesheet type="text/xsl" href="/xsl/guide.xsl" ?>
<!DOCTYPE sections SYSTEM "/dtd/book.dtd">

<!-- The content of this document is licensed under the CC-BY-SA license -->
<!-- See http://creativecommons.org/licenses/by-sa/2.5 -->

<!-- $Header: /var/cvsroot/gentoo/xml/htdocs/doc/en/handbook/2007.0/hb-install-next.xml,v 1.4 2007/05/07 18:11:42 nightmorph Exp $ -->

<sections>

<version>8.0</version>
<date>2007-05-07</date>

<section>
<title>文档</title>
<subsection>
<body>

<p>
恭喜！您现在拥有了一个可以运转的Gentoo系统。但接下来往何处去？现在您拥有什么样的选择？先探索些什么？Gentoo为它的用户提供了大量的可能性，因此也有大量已经提供文档（少量没有）的特性。
</p>

<p>
您无疑应该先看一下Gentoo手册里标题为<uri link="?part=2">在Gentoo中工作</uri>的那一章节，那里解释了如何保证您随时用上最新的软件，如何安装更多的软件，什么是USE标记，以及Gentoo Init系统是如何工作的等等。
</p>

<p>
如果您有兴趣对系统进行优化以使其适合桌面应用，或者您想了解如何将您的系统配置成一个完整可用的桌面系统，请参阅我们所提供的全面的<uri link="/doc/zh_cn/index.xml?catid=desktop">Gentoo桌面文档资源</uri>。另外，我们也提供<uri link="/doc/zh_cn/guide-localization.xml">本地化指南</uri>供您参考，利用它您可以使您的系统看起来更加本地化。
</p>

<p>
我们还提供了一份值得您阅读的<uri link="/doc/zh_cn/security/">Gentoo安全手册</uri>
</p>

<p>
您如果想得到一份我们已有的可用文档的列表，请查看我们提供的<uri link="/doc/zh_cn/index.xml">文档资源</uri>页面。
</p>

</body>
</subsection>
</section>
<section>
<title>线上Gentoo</title>
<body>

<p>
当然也非常欢迎您加入我们的<uri link="http://forums.gentoo.org">Gentoo论坛</uri>或者我们建立的<uri link="/main/en/irc.xml">Gentoo IRC 频道</uri>中的任意一个。
</p>

<p>
我们也有一些<uri link="/main/en/lists.xml">邮件列表</uri>是面对所有用户开放的。加入列表的方法已包含在前述页面中。
</p>

<p>
现在，我们将保持安静，以便让您享受您的安装过程。
</p>

</body>
</section>
<section>
<title>由2007.0版以来Gentoo的变更</title>
<subsection>
<title>变更？</title>
<body>

<p>
Gentoo是一个更新快速的发行版。接下来的章节将为您描述一些会影响Gentoo安装的重要的变更。我们只列出那些在安装中通常会遇到的，那些在安装中不会发生变化的包将不会给出。
</p>

<p>
到目前为止还没有重要的变更。
</p>

</body>
</subsection>
</section>
</sections>

