<?xml version='1.0' encoding='UTF-8'?>
<?xml-stylesheet type="text/xsl" href="/xsl/guide.xsl" ?>
<!DOCTYPE book SYSTEM "/dtd/book.dtd">

<!-- $Header: /var/www/www.gentoo.org/raw_cvs/gentoo/xml/htdocs/proj/en/devrel/handbook/handbook.xml,v 1.3 2004/08/24 21:07:26 plasmaroo Exp $ -->

<book link="handbook.xml">
  <title>Gentoo开发手册</title>

  <!-- Ebuild HOWTO -->
  <author title="Ebuild HOWTO - Author">
    Donny Davies<!-- No longer a developer; unknown@... -->
  </author>
  <author title="Author">
    <mail link="pete@gentoo.org">Peter Gavin</mail>
  </author>
  <author title="Author">
    <mail link="karltk@gentoo.org">Karl Trygve Kalleberg</mail>
  </author>
  <author title="Author">
    <mail link="vapier@gentoo.org">Mike Frysinger</mail>
  </author>
  <author title="Author/Editor">
    <mail link="drobbins@gentoo.org">Daniel Robbins</mail>
  </author>
  <author title="Author/Editor"><!-- zhen@gentoo.org -->
    John P. Davis
  </author>
  <author title="Editor">
    <mail link="peesh@gentoo.org">Jorge Paulo</mail>
  </author>
  <author title="Editor">
    <mail link="swift@gentoo.org">Sven Vermeulen</mail>
  </author>
  <author title="Editor">
    <mail link="klasikahl@gentoo.org">Zack Gilburd</mail>
  </author>
  <author title="Editor">
    <mail link="bennyc@gentoo.org">Benny Chuang</mail>
  </author>
  <author title="Editor">
    <mail link="erwin@gentoo.org">Erwin</mail>
  </author>

  <!-- :: EClass HOWTO -->

  <!-- Zhen; mentioned above... -->
  <author title = "Eclass HOWTO - Author">
    <mail link="danarmak@gentoo.org">Dan Armak</mail>
  </author>

  <!-- :: Common mistakes -->
  
  <author title="Common Ebuild Mistakes - Author">
    <mail link="liquidx@gentoo.org">Alastair Tse</mail>
  </author>
  
  <!-- :: Metadata -->

  <!-- SwifT; mentioned above... -->
  <author title="Metadata Document - Author">
    <mail link="pauldv@gentoo.org">Paul De Vrieze</mail>
  </author>

  <!-- Ebuild policy -->

  <!-- drobbins, karltk, liquidx, vapier, SwifT mentioned above... -->
  <author title="Ebuild Policy - Original Author">Owen Stampflee</author> 
  <author title="Editor">
    <mail link="seemant@gentoo.org">Seemant Kulleen</mail>
  </author> 
  <author title="Editor">
    <mail link="avenj@gentoo.org">Jon Portnoy</mail>
  </author>
  <author title="Editor">
    <mail link="carl@gentoo.org">Carl Anderson</mail>
  </author>

  <author title="Contributor">
    <mail link="ciaranm@gentoo.org">Ciaran McCreesh</mail>
  </author>

  <author title="Author/Editor">
    <mail link="plasmaroo@gentoo.org">Tim Yamin</mail>
  </author>

  <author title="Editors">
    Gentoo Developer Relations Team
  </author>

  <author title="Translator">
    <mail link="joanphan@gmail.com">Hans Joanphan</mail>
  </author>

  <abstract>
    This is the Gentoo Developer Handbook, a continuing effort to
    centralize development policies across Gentoo and to also outline
    Gentoo's development systems and procedures.
  </abstract>

  <!-- The content of this document is licensed under the CC-BY-SA license -->
  <!-- See http://creativecommons.org/licenses/by-sa/1.0 -->
  <license/>

  <version>1.0</version>
  <date>August 08, 2004</date>

  <part>
    <title>介绍</title>
    <abstract>
      这个部分覆盖了Gentoo的开发绝大部分的领域。这部分只是对于一个Gentoo开发者才有关系，否则你可以跳过这一部分。
    </abstract>

    <chapter>
      <title>介绍</title>
      <abstract>
	这一节概括了Gentoo开发手册的目的。
      </abstract>
      <include href="hb-introduction.xml"/>
    </chapter>

    <chapter>
      <title>成为一个开发者</title>
      <abstract>
	这一节主要要解释怎样成为一个Gentoo开发者
      </abstract>
      <include href="hb-introduction-becoming-a-dev.xml"/>
    </chapter>

    <chapter>
      <title>你将获得什么</title>
      <abstract>
	这一节概述了对于Gentoo开发者提供的服务。
      </abstract>
      <include href="hb-introduction-whatyouget.xml"/>
    </chapter>

    <chapter>
      <title>帮助新开发人员</title>
      <abstract>
	这部分给新的开发人员提供了帮助和指南。
      </abstract>
      <include href="hb-introduction-new-devs.xml"/>
    </chapter>

    <chapter>
      <title>开发者的等级</title>
      <abstract>
	这一节概述了Gentoo开发者和开发的等级。
      </abstract>
      <include href="hb-introduction-hierachy.xml"/>
    </chapter>
  </part>

  <part>
    <title>手册</title>
    <abstract>
      这一节概述和解释了不同的开发过程，并给Gentoo开发人员提供标准。
    </abstract>

    <chapter>
      <title>Ebuild手册</title>
      <abstract>
	这一节描述了Gentoo Linux的Portage系统，怎样为Gentoo创建新的软件包，在某一程度上也是Gentoo开发人员的标准。这是进程中的一个状态，还会不断的更新和改变，永远都不会结束。你应该联合这篇文档和Portage提供的man页面（特别是ebuild(5)）以及Gentoo Linux开发策略来使用。
      </abstract>
      <include href="hb-guide-ebuild.xml"/>
    </chapter>

    <chapter>
      <title>Eclass手册</title>
      <abstract>
	这一节用于提高给开发者一个eclass怎样工作和怎样应用到ebuild的详细指南。
      </abstract>
      <include href="hb-guide-eclass.xml"/>
    </chapter>

    <chapter>
      <title>常见的ebuild错误</title>
      <abstract>
	这一节解释了贡献者和开发者在书写和提交ebuild时常常出现的错误。
      </abstract>
      <include href="hb-guide-common-mistakes.xml"/>
    </chapter>

    <chapter>
      <title>Gentoo Metadata</title>
      <abstract>
	这一节解释了用于Portage树里的必要性和使用方法。
      </abstract>
      <include href="hb-guide-metadata.xml"/>
    </chapter>

    <chapter>
      <title>Ebuild维护手册</title>
      <abstract>
	这一节描述了在维护Portage树里的Ebuild时开发者执行日常工作的过程。
      </abstract>
      <include href="hb-guide-ebuild-maintaining.xml"/>
    </chapter>
  </part>

  <part>
    <title>策略</title>
    <abstract>
      这部分覆盖了开发者提交项目到CVS时需遵守的策略和方针。
    </abstract>

    <chapter>
      <title>Ebuild的策略</title>
      <abstract>
	这一节概述了Portage里每个ebuild必须遵守的策略。
      </abstract>
      <include href="hb-policy-ebuild.xml"/>
    </chapter>

    <chapter>
      <title>Etiquette的策略</title>
      <abstract>
	这一节概述了Gentoo开发者的礼仪策略。
      </abstract>
      <include href="hb-policy-etiquette.xml"/>
    </chapter>
  </part>

<!--
  <part>
    <title>Appendix 1: Management</title>
    <abstract>
      This part covers managerial policies.
    </abstract>
  </part>
-->

</book>
