<?xml version="1.0" encoding="UTF-8"?>
<!-- $Header$ -->
<!-- English CVS version: 1.4 -->
<!DOCTYPE sections SYSTEM "/dtd/book.dtd">
<!-- The content of this document is licensed under the CC-BY-SA license 
 See http://creativecommons.org/licenses/by-sa/1.0 -->
<sections>

<version>1.0</version>
<date>2005-05-31</date>

<section>
<title>挂载分区</title>
<body>

<p>
在挂载一个<c>ext2</c>，<c>ext3</c>或者<c>reiserfs</c>格式的分区的时候，你有几个能够加入到<path>/etc/fstab</path>里面的选项。这些选项是：
</p>

<ul>
<li>
  <c>nosuid</c> － 忽略SUID bit，并且使它像一个正常文件一样
</li>
<li>
  <c>noexec</c> - 阻止来自这个分区的文件的执行
</li>
<li>
  <c>nodev</c> - 忽略设备
</li>
</ul>

<p>
很不幸的是，这些选项可以很容易地通过一个间接的途径而被绕过。然而，把<path>/tmp</path>设置成noexec模式能阻止大多数需要直接从/tmp里执行的漏洞攻击程序的攻击。
</p>

<pre caption="/etc/fstab">
/dev/sda1 /boot ext2 noauto,noatime 1 1
/dev/sda2 none swap sw 0 0
/dev/sda3 / reiserfs notail,noatime 0 0
/dev/sda4 /tmp reiserfs notail,noatime,nodev,nosuid,noexec 0 0
/dev/sda5 /var reiserfs notail,noatime,nodev 0 0
/dev/sda6 /home reiserfs notail,noatime,nodev,nosuid 0 0
/dev/sda7 /usr reiserfs notail,noatime,nodev,ro 0 0
/dev/cdroms/cdrom0 /mnt/cdrom iso9660 noauto,ro 0 0
proc /proc proc defaults 0 0
</pre>

<warn>
把<path>/tmp</path>设置成<c>noexec</c>模式可以阻止某些脚本的正确运行。
</warn>

<note>
更多有关磁盘限额的信息请查看<uri 
link="?part=1&amp;chap=5#quotas">磁盘限额</uri>。
</note>

<note>
即使来自<path>/var</path>的文件通常是永远不会被执行,我也没有给它加上<c>noexec</c>或者<c>nosuid</c>选项，这是因为我安装了netqmail，它被安装在<path>/var/qmail</path>，并且它必须被允许执行和处理一个SUID文件。
除非我要升级Gentoo，否则我把<path>/usr</path>设置成只读模式，这是因为我除了升级以外从来不写任何东西到那里面去。在我要升级Gentoo的时候，我会重新用读写模式挂载文件系统，接着升级，最后再次使用只读模式挂载它。
</note>

<note>
即使你不用netqmail，Gentoo仍然需要你给<path>/var/tmp</path>设置可运行选项，因为ebuild是在这里生成的。但是如果你坚持把<path>/var</path>挂载成<c>noexec</c>模式，还有一个可替代的路径设置。</note>

</body>
</section>
</sections>
